{
  "registry_lock_version": "0.1.0",
  "iana_language_subtag_registry": {
    "file_date": "2026-08-08",
    "path": "iana-language-subtag-registry-2026-08-08.txt",
    "byte_length": 731799,
    "sha256_raw": "sha256:be21e91b6851f750a7b1a687f11209d46ad5a8471d6b10a1efc8d1dac4c8a926"
  },
  "iana_language_tag_extensions_registry": {
    "file_date": "2014-04-02",
    "path": "iana-language-tag-extensions-registry-2014-04-02.txt",
    "byte_length": 1069,
    "sha256_raw": "sha256:fdf7764455c493c245a9b3b5b9cd3938391f0637302c3e943fde86aee652e376"
  },
  "unicode": {
    "version": "15.1.0",
    "normalization": "UAX15",
    "text_segmentation": "UAX29",
    "bidirectional_algorithm": "UAX9",
    "security_mechanisms": "UTS39"
  },
  "qualification_rule": "Schema format checks are syntax prefilters only. Qualified RFC5646 validation requires a deterministic validator that verifies this lock, parses both complete IANA snapshots with exact redundant-tag precedence and registered extension singletons, reports matching Unicode data, and passes the registered language and Unicode vector cases. Package-content normalization, protected-span, Bidi, UAX9, UAX29, and UTS39 checks remain separate."
}
